{
  "$schema": "https://hygieneroll.com/reference/schema/reference-case-record.schema.json",
  "assumptions": [
    "Use is exactly 3 rolls every week.",
    "Lead time and buffer are whole days chosen for the example."
  ],
  "case": {
    "id": "HRR-001",
    "purpose": "A household with steady use and no variability allowance. It shows the simplest path from supply to a single depletion day, a single planning trigger, and a reorder threshold.",
    "slug": "stable-consumption",
    "status": "PUBLISHED",
    "title": "Stable consumption (synthetic)",
    "version": 1
  },
  "derivation": [
    "Weekly method: r = 3 rolls per week. Variability 0%, so slow = fast = 3.",
    "Depletion: 12 / 3 × 7 = 28 days exactly. Single day 28.",
    "Planning trigger: 28 − 3 − 4 = 21.",
    "Replenishment quantity blank, so R = 12 and cadence = 28 days.",
    "Lead-time demand: 3 × 3 / 7 = 1.2857… → rounded up to 1.29. Reserve: 4 × 3 / 7 = 1.7142… → 1.72. Threshold 1.29 + 1.72 = 3.01. 12 > 3.01, so not at or below.",
    "Slip +3: lead 6. Re-planned trigger 28 − 6 − 4 = 18. Ordered on day 21, arrival 27. 27 ≤ 28, so no gap. 27 > 28 − 4 = 24, so the buffer is drawn.",
    "Slip +7: lead 10. Re-planned trigger 28 − 10 − 4 = 14. Arrival 21 + 10 = 31. Gap 31 − 28 = 3 at both bounds."
  ],
  "evidence": {
    "claim_class": "ILLUSTRATIVE_MODEL",
    "external_observations": [],
    "input_layer": "HYPOTHETICAL_SCENARIO",
    "origin": "SYNTHETIC",
    "output_layer": "DERIVED_CALCULATION",
    "source_ids": [],
    "statement": "Synthetic inputs chosen to exercise the method. They are not observed household behavior, consumption statistics, or benchmarks. Outputs are arithmetic on those inputs."
  },
  "expected": {
    "at_or_below_reorder_threshold": false,
    "consumption_rate_per_week": 3,
    "depletion_interval_days": {
      "earliest": 28,
      "latest": 28
    },
    "fixed_interval_fit": null,
    "lead_time_demand_units": 1.29,
    "lead_time_slip": [
      {
        "exposure_if_ordered_at_trigger": {
          "arrival_day": 27,
          "order_day": 21,
          "status": "BUFFER_DRAWN",
          "supply_gap_days": {
            "max": 0,
            "min": 0
          }
        },
        "replanned_trigger_days": {
          "earliest": 18,
          "latest": 18
        },
        "slip_days": 3
      },
      {
        "exposure_if_ordered_at_trigger": {
          "arrival_day": 31,
          "order_day": 21,
          "status": "STOCKOUT_AT_BOTH_BOUNDS",
          "supply_gap_days": {
            "max": 3,
            "min": 3
          }
        },
        "replanned_trigger_days": {
          "earliest": 14,
          "latest": 14
        },
        "slip_days": 7
      }
    ],
    "planning_trigger_days": {
      "earliest": 21,
      "latest": 21
    },
    "reorder_threshold_units": 3.01,
    "replenishment_cadence_days": {
      "earliest": 28,
      "latest": 28
    },
    "replenishment_quantity_applied": 12,
    "reserve_stock_units": 1.72,
    "usage_bounds_per_week": {
      "fast": 3,
      "slow": 3
    }
  },
  "inputs": {
    "bufferDays": 4,
    "category": "PAPER_HYGIENE",
    "durationWeeks": null,
    "intervalDays": null,
    "leadTimeDays": 3,
    "name": "Toilet tissue (synthetic)",
    "quantity": 12,
    "replenishmentQuantity": null,
    "unit": "rolls",
    "unitKind": "preset",
    "usageMode": "weekly",
    "variabilityPercent": 0,
    "weeklyUsage": 3
  },
  "limitations": [
    "A 0% variability allowance gives a single day. It does not mean use is certain."
  ],
  "methodology": {
    "document": "https://hygieneroll.com/CALCULATOR_METHODOLOGY.md",
    "engine": {
      "url": "https://hygieneroll.com/assets/js/replenishment-engine.js",
      "version": "v0.2.1"
    },
    "ontology": {
      "url": "https://hygieneroll.com/reference/replenishment-ontology.json",
      "version": "0.1"
    },
    "steps": [
      {
        "concept": "HRO-005",
        "formula": "weekly method: r = weekly_usage; duration method: r = current_quantity / duration_weeks",
        "term": "Consumption rate"
      },
      {
        "concept": "HRO-008",
        "formula": "slow = r × (1 − v); fast = r × (1 + v); v = variability_percent / 100",
        "term": "Usage bounds"
      },
      {
        "concept": "HRO-009",
        "formula": "earliest = floor((q / fast) × 7); latest = ceil((q / slow) × 7); at v = 0 both equal round_half_up((q / r) × 7)",
        "term": "Depletion interval"
      },
      {
        "concept": "HRO-012",
        "formula": "ceil_0.01(lead_time_days × fast / 7)",
        "term": "Lead-time demand"
      },
      {
        "concept": "HRO-013",
        "formula": "ceil_0.01(safety_buffer_days × fast / 7)",
        "term": "Reserve stock"
      },
      {
        "concept": "HRO-014",
        "formula": "lead_time_demand + reserve_stock",
        "term": "Reorder threshold"
      },
      {
        "concept": "HRO-015",
        "formula": "max(0, depletion − lead_time_days − safety_buffer_days), each end separately",
        "term": "Planning trigger"
      },
      {
        "concept": "HRO-017",
        "formula": "same day-window rule as the depletion interval, with replenishment_quantity in place of q",
        "term": "Replenishment cadence"
      },
      {
        "concept": "HRO-020",
        "formula": "arrival = order_day + lead_time; max = max(0, ceil(arrival − depletion.earliest)); min = max(0, ceil(arrival − depletion.latest))",
        "term": "Stockout exposure"
      },
      {
        "concept": "HRO-021",
        "formula": "for each offset s: trigger(depletion, lead_time + s, buffer); stockout_exposure(order_day = trigger.earliest, lead_time + s)",
        "term": "Lead-time slip"
      },
      {
        "concept": "HRO-022",
        "formula": "items with minimum planning_trigger.earliest, in input order",
        "term": "Next household return"
      }
    ]
  },
  "ontology_terms": [
    {
      "id": "HRO-001",
      "layer": "PROJECT_DEFINITION",
      "term": "Product category",
      "url": "https://hygieneroll.com/reference.html#term-product-category"
    },
    {
      "id": "HRO-002",
      "layer": "PROJECT_DEFINITION",
      "term": "Consumption unit",
      "url": "https://hygieneroll.com/reference.html#term-consumption-unit"
    },
    {
      "id": "HRO-003",
      "layer": "HYPOTHETICAL_SCENARIO",
      "term": "Household demand profile",
      "url": "https://hygieneroll.com/reference.html#term-household-demand-profile"
    },
    {
      "id": "HRO-004",
      "layer": "HYPOTHETICAL_SCENARIO",
      "term": "Current supply",
      "url": "https://hygieneroll.com/reference.html#term-current-supply"
    },
    {
      "id": "HRO-005",
      "layer": "DERIVED_CALCULATION",
      "term": "Consumption rate",
      "url": "https://hygieneroll.com/reference.html#term-consumption-rate"
    },
    {
      "id": "HRO-006",
      "layer": "HYPOTHETICAL_SCENARIO",
      "term": "Usage assumption",
      "url": "https://hygieneroll.com/reference.html#term-usage-assumption"
    },
    {
      "id": "HRO-007",
      "layer": "HYPOTHETICAL_SCENARIO",
      "term": "Variability allowance",
      "url": "https://hygieneroll.com/reference.html#term-variability-allowance"
    },
    {
      "id": "HRO-008",
      "layer": "DERIVED_CALCULATION",
      "term": "Usage bounds",
      "url": "https://hygieneroll.com/reference.html#term-usage-bounds"
    },
    {
      "id": "HRO-009",
      "layer": "DERIVED_CALCULATION",
      "term": "Depletion interval",
      "url": "https://hygieneroll.com/reference.html#term-depletion-interval"
    },
    {
      "id": "HRO-010",
      "layer": "HYPOTHETICAL_SCENARIO",
      "term": "Fulfillment lead time",
      "url": "https://hygieneroll.com/reference.html#term-fulfillment-lead-time"
    },
    {
      "id": "HRO-011",
      "layer": "HYPOTHETICAL_SCENARIO",
      "term": "Safety buffer",
      "url": "https://hygieneroll.com/reference.html#term-safety-buffer"
    },
    {
      "id": "HRO-012",
      "layer": "DERIVED_CALCULATION",
      "term": "Lead-time demand",
      "url": "https://hygieneroll.com/reference.html#term-lead-time-demand"
    },
    {
      "id": "HRO-013",
      "layer": "DERIVED_CALCULATION",
      "term": "Reserve stock",
      "url": "https://hygieneroll.com/reference.html#term-reserve-stock"
    },
    {
      "id": "HRO-014",
      "layer": "DERIVED_CALCULATION",
      "term": "Reorder threshold",
      "url": "https://hygieneroll.com/reference.html#term-reorder-threshold"
    },
    {
      "id": "HRO-015",
      "layer": "DERIVED_CALCULATION",
      "term": "Planning trigger",
      "url": "https://hygieneroll.com/reference.html#term-planning-trigger"
    },
    {
      "id": "HRO-016",
      "layer": "HYPOTHETICAL_SCENARIO",
      "term": "Replenishment quantity",
      "url": "https://hygieneroll.com/reference.html#term-replenishment-quantity"
    },
    {
      "id": "HRO-017",
      "layer": "DERIVED_CALCULATION",
      "term": "Replenishment cadence",
      "url": "https://hygieneroll.com/reference.html#term-replenishment-cadence"
    },
    {
      "id": "HRO-020",
      "layer": "DERIVED_CALCULATION",
      "term": "Stockout exposure",
      "url": "https://hygieneroll.com/reference.html#term-stockout-exposure"
    },
    {
      "id": "HRO-021",
      "layer": "DERIVED_CALCULATION",
      "term": "Lead-time slip",
      "url": "https://hygieneroll.com/reference.html#term-lead-time-slip"
    },
    {
      "id": "HRO-022",
      "layer": "DERIVED_CALCULATION",
      "term": "Next household return",
      "url": "https://hygieneroll.com/reference.html#term-next-household-return"
    },
    {
      "id": "HRO-023",
      "layer": "PROJECT_DEFINITION",
      "term": "Scenario record",
      "url": "https://hygieneroll.com/reference.html#term-scenario-record"
    }
  ],
  "parameters": [
    {
      "concept": "HRO-001",
      "field": "category",
      "unit": "code",